{
  "id": "svc-aws-bedrock",
  "type": "service",
  "name": "Amazon Bedrock managed inference",
  "provider": "aws-bedrock",
  "endpoint_url": "https://bedrock-runtime.us-east-1.amazonaws.com",
  "models_served": [
    "claude-sonnet-5-5",
    "claude-opus-5-5",
    "claude-haiku-4-5",
    "llama-3-3-70b",
    "llama-4-scout",
    "llama-4-maverick",
    "deepseek-v3",
    "mixtral-8x7b",
    "mixtral-8x22b"
  ],
  "price_input_per_mtok_usd": null,
  "price_output_per_mtok_usd": null,
  "price_basis": "USD per 1M TOKENS, PER-MODEL PER-REGION list table - this is why both price fields are null: Bedrock has no single price. Every model is priced separately per AWS region via provider tabs on aws.amazon.com/bedrock/pricing (Anthropic, Meta, DeepSeek, OpenAI, Qwen, Mistral, xAI, Z AI and others), the price cells render client-side and did not extract on 2026-10-14, and regional prices differ (a Meta or Anthropic model in us-east-1 is not the eu-west-1 number). Known structural facts, first-party: batch inference = 50% below on-demand for select FMs; service tiers are Standard / Flex / Priority / Reserved; provisioned throughput is a separate per-model-unit hourly price. One anchor row visible in the legacy table: Llama 2 Chat 70B $1.95/$2.56.",
  "context_window": null,
  "measured_ttft_ms": null,
  "measured_tps": null,
  "measurement_source": "artificial-analysis",
  "regions": [
    "us-east-1",
    "us-west-2",
    "eu-west-1",
    "eu-central-1",
    "ap-southeast-1",
    "ap-northeast-1"
  ],
  "notes": "The compliance-and-regions answer rather than the cheap answer: Bedrock's value is that models run inside the buyer's AWS account boundary with IAM, CloudTrail and PrivateLink, across ~30 regions - Artificial Analysis benchmarks it on Llama 3.3 70B alongside the independent providers but the live cells did not extract today, so the measured fields stay null. Prices are quoted per model + region + tier; cross-region inference profiles (US/EU/geo CRIS) add another pricing axis. models_served is a sample of the FM catalog spelled as repo model slugs; provider-side ids are namespaced (anthropic.claude-*, meta.llama*).",
  "status": "verified",
  "confidence": 0.7,
  "updated": "2026-10-14",
  "sources": [
    "svc-src-aws-bedrock-pricing-2026-10-14",
    "svc-src-artificialanalysis-llama33-70b-providers-2026-10-14"
  ]
}
